"","date_utc","timestamp","title","text","subreddit","comments","url"
"1","2023-10-21",1697898280,"Tensions rise as Haley vies to overtake DeSantis as Trump alternative","","nikkihaley",2,"https://www.reddit.com/r/nikkihaley/comments/17d3q7y/tensions_rise_as_haley_vies_to_overtake_desantis/"
"2","2023-10-20",1697836581,"Opinion | Nikki Haley might have an ace in the hole: Independent voters","","nikkihaley",0,"https://www.reddit.com/r/nikkihaley/comments/17clq0s/opinion_nikki_haley_might_have_an_ace_in_the_hole/"
"3","2023-10-20",1697836237,"Nikki Haley discusses Chinese land acquisitions with Town Hall Audience.","","nikkihaley",0,"https://www.reddit.com/r/nikkihaley/comments/17cllao/nikki_haley_discusses_chinese_land_acquisitions/"
"4","2023-10-19",1697753446,"The Real Reason Trumps Challengers Are Still Hanging on","","nikkihaley",1,"https://www.reddit.com/r/nikkihaley/comments/17bv6u3/the_real_reason_trumps_challengers_are_still/"
"5","2023-10-17",1697585649,"Our enemies are an evil alliance taking advantage of our weakness around the world","","nikkihaley",0,"https://www.reddit.com/r/nikkihaley/comments/17ac4ze/our_enemies_are_an_evil_alliance_taking_advantage/"
"6","2023-10-16",1697482908,"Nikki Haleys Long Shot Bid Might Be the GOPs Best Shot at Dumping Trump. As support for Trump continues to grow, much of the data suggests that Haley is pulling supporters from DeSantis and other also-ran candidates.","","nikkihaley",5,"https://www.reddit.com/r/nikkihaley/comments/179dr1r/nikki_haleys_long_shot_bid_might_be_the_gops_best/"
"7","2023-10-16",1697457391,"Trump is crushing his GOP competition in polls  and cash","","nikkihaley",1,"https://www.reddit.com/r/nikkihaley/comments/179490r/trump_is_crushing_his_gop_competition_in_polls/"
"8","2023-10-15",1697407899,"Tapper cuts off Haley for blaming Biden for House not having Speaker","","nikkihaley",1,"https://www.reddit.com/r/nikkihaley/comments/178qjsi/tapper_cuts_off_haley_for_blaming_biden_for_house/"
"9","2023-10-15",1697384823,"Republican Presidential Candidate Nikki Haley Discusses Israel-Palestine...","","nikkihaley",0,"https://www.reddit.com/r/nikkihaley/comments/178i6z6/republican_presidential_candidate_nikki_haley/"
"10","2023-10-13",1697224565,"Nikki Haley tells N.H. voters why Trump shouldn't be the president: 'Leave the negativity and chaos'","","nikkihaley",0,"https://www.reddit.com/r/nikkihaley/comments/1776ctd/nikki_haley_tells_nh_voters_why_trump_shouldnt_be/"
"11","2023-10-13",1697217505,"Is Nikki Haley bought and paid for?","[https://www.leefang.com/p/nikki-haleys-sudden-wealth-rooted](https://www.leefang.com/p/nikki-haleys-sudden-wealth-rooted)

It would seem like Vivek was right all along.","nikkihaley",4,"https://www.reddit.com/r/nikkihaley/comments/1773rqu/is_nikki_haley_bought_and_paid_for/"
"12","2023-10-13",1697203305,"Presidential candidate Nikki Haley responds to Trump's comments on Israel and Hezbollah","","nikkihaley",0,"https://www.reddit.com/r/nikkihaley/comments/176ymmg/presidential_candidate_nikki_haley_responds_to/"
"13","2023-10-13",1697173465,"Nikki Haley Responds To Vivek's Charge That She Will Personally Profit F...","","nikkihaley",1,"https://www.reddit.com/r/nikkihaley/comments/176qyzw/nikki_haley_responds_to_viveks_charge_that_she/"
"14","2023-10-12",1697153095,"Nikki Haley Is the New Ron DeSantis","","nikkihaley",9,"https://www.reddit.com/r/nikkihaley/comments/176kobj/nikki_haley_is_the_new_ron_desantis/"
"15","2023-10-12",1697096433,"$3 Underestimate me, That'll be fun shirt","","nikkihaley",0,"https://www.reddit.com/r/nikkihaley/comments/17619mo/3_underestimate_me_thatll_be_fun_shirt/"
"16","2023-10-11",1697025130,"Opinion | Tim Scott, please drop out, urge others to follow and unite behind Haley","","nikkihaley",0,"https://www.reddit.com/r/nikkihaley/comments/175c5xd/opinion_tim_scott_please_drop_out_urge_others_to/"
"17","2023-10-10",1696978542,"RFK Jr. says he's running for president as an independent","","nikkihaley",0,"https://www.reddit.com/r/nikkihaley/comments/174yr0b/rfk_jr_says_hes_running_for_president_as_an/"
"18","2023-10-09",1696891822,"Former GOP Rep. Will Hurd suspends presidential campaign, backs Haley","","nikkihaley",1,"https://www.reddit.com/r/nikkihaley/comments/1745i7m/former_gop_rep_will_hurd_suspends_presidential/"
"19","2023-10-08",1696788162,"$5 Bring It shirt","","nikkihaley",1,"https://www.reddit.com/r/nikkihaley/comments/1735ks4/5_bring_it_shirt/"
"20","2023-10-08",1696783761,"Republican Presidential Candidate Nikki Haley Discusses Israel Attack On NBC's Meet The Press","","nikkihaley",2,"https://www.reddit.com/r/nikkihaley/comments/1733uys/republican_presidential_candidate_nikki_haley/"
"21","2023-10-07",1696696274,"Fact Checking Nikki Haleys claim that Joe Biden added 20 million ineligible people to Medicaid","","nikkihaley",1,"https://www.reddit.com/r/nikkihaley/comments/172ag8l/fact_checking_nikki_haleys_claim_that_joe_biden/"
"22","2023-10-03",1696336428,"Nikki Haley campaign fires back at Trump team's 'creepy and desperate' birdcage gift","","nikkihaley",0,"https://www.reddit.com/r/nikkihaley/comments/16yqppq/nikki_haley_campaign_fires_back_at_trump_teams/"
"23","2023-10-02",1696221520,"Anybody Have Any Reassuring Evidence That Nikki Haley Could Win The Nomination?","I would love for both parties to rid themselves of Trump / Biden and each put forward their strongest candidate (for the Republicans I feel that's Nikki Haley), however it seems like there's very little chance of that actually happening due to the commanding hold both of these figures have on their parties.  Is there any convincing data or history that would point to Haley's chances of winning the nomination being better than they seem?  The arguments for and against this that I'm already aware of are...

**Arguments Against Her Chances:**

Trump currently holds 55% of the vote (with 35% of Republicans permanently locked in and 20% leaning towards him but open to change) so not only does she have to climb up to second place and knock out all the other candidates before Super Tuesday, but she also has to consolidate the anti-Trump vote and take some of his voters too.  And if any of the other candidates refuse to drop out, playing spoiler like John Kasich did to Ted Cruz in 2016, she automatically loses.  Ramaswamy is of particular concern since he's already a billionaire and may be running to become Trump's VP, so a cabinet offer would be unlikely to convince him to drop out.  And Ron DeSantis is of particular concern too as he may trail her closely enough that he ends up holding out hope for too long and by the time he drops out it ends up being too late (although I could see a VP offer maybe working on him).

None of Trump's various criminal trials will conclude until after the race is over and they don't even start until the day before Super Tuesday and he could end up unaffected or even strengthened by them.  At the start of the year DeSantis and Trump were in a tight race, however once the indictments started rolling in, more and more Republicans rallied around Trump as their candidate in a compulsive need to defend him.  And overall Trump's lead has been very durable, further demonstrated by the fact that the first debate had zero lasting impact on his polling numbers.

Trump also has a massive number of endorsements.  Going by the 538 methodology he has 365 points compared to the 90 points the rest of the field has combined (nobody wants to get attacked by Trump and his base for endorsing someone other than him).

Republicans have spent the past six years choosing awful MAGA candidates Independents hate instead of prioritizing winning candidates like the Democrats usually do.  This hurts Haley since she's a winning candidate not a MAGA candidate.  You would think the Republicans would learn their lesson after three lost elections in a row, but I have serious doubts.

In regard to Haley versus DeSantis, something that could hurt her is that the polls currently indicate that he is the majority of Republicans' second choice should their preferred candidate drop out.

**Arguments In Favor Of Her Chances:**

If I'm not mistaken, back in 2007, at this point in the race, Clinton held a similarly massive lead over the rest of the field, but she ultimately ended up losing to Obama, which could point to this not necessarily being a done deal yet.  Furthermore, of the four past races with similarly large gaps, the leading candidate lost half of them, (although Trump's situation is completely unprecedented, and I'd be inclined to believe his past incumbency benefits him greatly).

Haley has been spending the most time campaigning on the ground in these early states of any candidate by far and will also likely continue to keep winning these presidential debates.  Because of this, there's a solid chance she continues to rise in the polls and eventually passes DeSantis before the race even begins.  She could also end up being massively helped by the fact that she's clearly the most electable candidate by a large margin (something that has been shown in public polls and leaks from the Democratic party) due to her being a relatively young woman of color with a calm demeanor (return to normalcy candidate), a strong gubernatorial track record, and policy positions that appeal to moderates; electability being the strongest argument against Trump but something the other candidates haven't been able to demonstrate being any better than Trump on.

The polls could be greatly overestimating Trump's support due to the fact we're still very far off from the election and historically people still aren't paying very much attention at this point (which benefits Trump due to him having by far the strongest name recognition of Republican in the country).  As we near election day and people start paying attention, the polls could tighten.  And on the day people step into that voting booth and are forced to contemplate their decision, when push comes to shove they may actually find themselves indeed weighed down by his impending legal troubles, caving in and voting for the candidate they think can best win a general election as opposed to the candidate who would be the most satisfying middle finger to the Democratic party.

Trump's fundraising has been pretty weak and he's spending almost all of it on his legal bills instead of actually using it to try to win over voters.  Furthermore, his fraud trial is already a forgone conclusion due to it taking place in New York, meaning around the time the race begins Trump will lose access to all his New York assets (which is most of his assets) and will be fined a quarter of a billion dollars on top of that, putting him in notable financial trouble for personally funding a campaign.

In regard to Haley versus DeSantis, in contrast to her upward momentum, he has downward momentum.  There's also a bit of a self-fulfilling prophesy going on because by having the entire media constantly talk about how she's on the rise and he's on the fall, it makes voters feel more confident about switching to her and less confident about sticking with him.  He also has significant charisma issues whereas she's easily in the Top 3 in terms of charisma.

&amp;#x200B;

Unfortunately for me though the negatives (particularly that gargantuan polling gap between him and the rest of the field) are significantly outweighing the positives, so if anybody has any convincing evidence for her chances, I'd love to see it, I would like to be able to be more hopeful about her chances rather than feel like both parties are doomed to push the same crappy nominees again.","nikkihaley",8,"https://www.reddit.com/r/nikkihaley/comments/16xna56/anybody_have_any_reassuring_evidence_that_nikki/"
"24","2023-09-29",1695990464,"Only Republican with a sensible foreign policy agenda","","nikkihaley",2,"https://www.reddit.com/r/nikkihaley/comments/16vaavc/only_republican_with_a_sensible_foreign_policy/"
"25","2023-09-29",1695958582,"I think Nikki Haley has a shot at the presidency.","I left the Democratic party to register Republican, but I can associate with the MAGA crowd. I guess I've come full circle, I was a Republican before I was legally allowed to vote, spent my young adult years as a Democrat and now back to a Republican. I realized the Democrats don't have my interests, this isn't the Democrats of 25 years ago that wanted to protect workers and wages. 

I have my issues with Nikki Haley, I just think they're tolerable compared to the alternatives.

1.) A senile Biden in 2024 again?

2.) Kamala in office after Biden dies?

3.) Trump is old news, I think normal people are beginning to realize it's time to move on.

The two debates have sold to me that Nikki Haley is at least a leader. People aren't happy that she's combative, we need someone like that in the White House now. Nikki isn't vain like Trump when she asserts some authority, it's coming from a place of respect for the law. 

I don't support her war politics, but immigration is simple and to the point; deport the ones here illegally and end it there. I'm someone who doesn't give a shit about white America declining, I don't give a shit about Spanish growing alongside English. What I care about is cartel gangs not carving my head up and leaving it outside my driveway. 

I'm not in favor of invading Mexico, but we need to defend our border and show the cartels we mean business. I don't believe foreign gangs deserve justice, if you invade our country, you should be dealt with swiftly. 

So, I see a potential two term president, just unsure what the GOP will do with Trump. Republicans are in a quandary where they don't want him, but they can't alienate their constituency and flat out ignore him. ","nikkihaley",14,"https://www.reddit.com/r/nikkihaley/comments/16v0wno/i_think_nikki_haley_has_a_shot_at_the_presidency/"
"26","2023-09-28",1695927347,"Does Nikki have a published political platform or list of policy positions?","I can't find anything specific on her official website on her positions on issues, nor anything about her plans.

I would be looking for something like what most other candidates have done.  Here's Vivek: [https://www.vivek2024.com/america-first-2-0/](https://www.vivek2024.com/america-first-2-0/); here's Pence: [https://mikepence2024.com/the-pence-plan/](https://mikepence2024.com/the-pence-plan/), here's Trump: [https://www.donaldjtrump.com/issues](https://www.donaldjtrump.com/issues)","nikkihaley",1,"https://www.reddit.com/r/nikkihaley/comments/16uo8wb/does_nikki_have_a_published_political_platform_or/"
"27","2023-09-28",1695927174,"If the GOP is the ""merit-based"" party it claims to be, then Nikki Haley should absolutely be the nominee>7@","","nikkihaley",1,"https://www.reddit.com/r/nikkihaley/comments/16uo67u/if_the_gop_is_the_meritbased_party_it_claims_to/"
"28","2023-09-28",1695918445,"Haley performance during 2nd debate","Haley got a lot of opportunity from the moderators to speak to her core positions last night. As always, she was well spoken, direct, and high energy. I had two points of feedback and I'm curious what yall think. 

1. Her position on China is incredibly aggressive. She mentioned completely cutting off trade to China. This is an extreme position in my opinion and is difficult to sell to the American people. 

2. Haley spent too much time being combative on stage. I liked her confidence and ability to think on her feet but would prefer to see that combativeness be focused on Biden. I understand she is trying to make the case against her republican opponents for the primary season. However it felt like she used these aggressive tactics too often and took away from her overall policy message.","nikkihaley",7,"https://www.reddit.com/r/nikkihaley/comments/16ukjt6/haley_performance_during_2nd_debate/"
"29","2023-09-21",1695333721,"Ron Finished, Haley takes place as main challenger","Feel kind of bad for Ron, maybe he could be VP or her a cabinet position? Its clear Haley is the only viable alternative to Trump.","nikkihaley",8,"https://www.reddit.com/r/nikkihaley/comments/16osteh/ron_finished_haley_takes_place_as_main_challenger/"
"30","2023-09-20",1695180976,"Republican Presidential Candidate Nikki Haley's Interview On Fox News' Hannity Show (FULL)","","nikkihaley",0,"https://www.reddit.com/r/nikkihaley/comments/16nb0bx/republican_presidential_candidate_nikki_haleys/"
"31","2023-09-11",1694442065,"Nikki Haley would destroy the US military","Her position on reimbursement for travel is incredibly dumb.

If you insist that military members and their family relocate to a location where medical treatment to which they have a right is not available and you refuse to cover the cost of travel, then you have two options.

A)  You allow military members to decide where they wish to be stationed.

B) You close all bases in areas that can not/will not provide medical treatment.

Both A and B result in the same thing, MASSIVE base closures across the entire South.  Easily cut the number of military bases in red states in half, if not removing them completely.

OR.... and this is radical, I know...

Let the military handle these issues as the military sees fit because it's not Congress' job to dictate issues regarding individual medical treatment.

&amp;#x200B;

Republicans need to stop supporting stupid candidates if they want to be treated like adults.","nikkihaley",14,"https://www.reddit.com/r/nikkihaley/comments/16fwk36/nikki_haley_would_destroy_the_us_military/"
"32","2023-09-10",1694354624,"Republican Presidential Candidate Nikki Haley's Interview On CNN's State...","","nikkihaley",1,"https://www.reddit.com/r/nikkihaley/comments/16f13ak/republican_presidential_candidate_nikki_haleys/"
"33","2023-09-09",1694228329,"#45 - The Best Republican Candidate Debate! Who is Better Nikki Haley or Donald Trump?","","nikkihaley",1,"https://www.reddit.com/r/nikkihaley/comments/16dufg7/45_the_best_republican_candidate_debate_who_is/"
"34","2023-09-07",1694113467,"Nikki Haley is GOPs best chance at beating Biden in 2024: poll","Haley Hive! =","nikkihaley",1,"https://www.reddit.com/r/nikkihaley/comments/16cn74m/nikki_haley_is_gops_best_chance_at_beating_biden/"
"35","2023-09-03",1693773576,"Republican Presidential Candidate Nikki Haley's Interview On CBS' Face T...","","nikkihaley",0,"https://www.reddit.com/r/nikkihaley/comments/1697nid/republican_presidential_candidate_nikki_haleys/"
"36","2023-09-03",1693771423,"Haley on Trump Legal Woes: Americans Will Not 'Vote for a Convicted Criminal'","","nikkihaley",0,"https://www.reddit.com/r/nikkihaley/comments/1696r73/haley_on_trump_legal_woes_americans_will_not_vote/"
"37","2023-09-02",1693679623,"Nikki Haley had her debate moment. Now, can she carry it forward? - Allan Smith, NBC","","nikkihaley",0,"https://www.reddit.com/r/nikkihaley/comments/168a19y/nikki_haley_had_her_debate_moment_now_can_she/"
"38","2023-09-02",1693631079,"Article by Kylie Atwood","","nikkihaley",0,"https://www.reddit.com/r/nikkihaley/comments/167tjdr/article_by_kylie_atwood/"
"39","2023-09-01",1693590271,"Nikki Haley Comic","The Nikki Haley comic book biography - http://www.comicbookandmoviereviews.com/2023/09/nikki-haley-five-page-preview.html","nikkihaley",0,"https://www.reddit.com/r/nikkihaley/comments/167du9v/nikki_haley_comic/"
"40","2023-09-01",1693566550,"Nikki Haley Calls Senate A 'Privileged Nursing Home' After McConnell Freezes","","nikkihaley",0,"https://www.reddit.com/r/nikkihaley/comments/167457l/nikki_haley_calls_senate_a_privileged_nursing/"
"41","2023-08-30",1693409774,"Is her nick name ""Nam"", short for Namrata?","","nikkihaley",1,"https://www.reddit.com/r/nikkihaley/comments/165i1ml/is_her_nick_name_nam_short_for_namrata/"
"42","2023-08-30",1693363754,"@nikkihaley 2024","","nikkihaley",1,"https://www.reddit.com/r/nikkihaley/comments/1652q9m/nikkihaley_2024/"
"43","2023-08-30",1693379560,"$5 Nikki Haley shirt, free shipping","","nikkihaley",0,"https://www.reddit.com/r/nikkihaley/comments/1657m4e/5_nikki_haley_shirt_free_shipping/"
"44","2023-08-30",1693368354,"@nikkihaley2024","","nikkihaley",1,"https://www.reddit.com/r/nikkihaley/comments/1654b7f/nikkihaley2024/"
"45","2023-08-30",1693363705,"@nikkihaley 2024 the best choice for this country","","nikkihaley",0,"https://www.reddit.com/r/nikkihaley/comments/1652pl7/nikkihaley_2024_the_best_choice_for_this_country/"
"46","2023-08-29",1693297195,"Should future US president Nikki Haley secure the lines of actual control over the Lunar $outh pole?","","nikkihaley",0,"https://www.reddit.com/r/nikkihaley/comments/164cgdb/should_future_us_president_nikki_haley_secure_the/"
"47","2023-08-28",1693241498,"#42 - Ranking All the Top Republican Nominees: From Worst to Best","","nikkihaley",3,"https://www.reddit.com/r/nikkihaley/comments/163rarg/42_ranking_all_the_top_republican_nominees_from/"
"48","2023-08-27",1693145754,"Vivek is clearly not who he says he is and Haley knows!","","nikkihaley",5,"https://www.reddit.com/r/nikkihaley/comments/162rjw5/vivek_is_clearly_not_who_he_says_he_is_and_haley/"
"49","2023-08-27",1693106150,"Nikki Haley's Post-Debate ""Victory Lap"" On CBS Mornings Show","","nikkihaley",1,"https://www.reddit.com/r/nikkihaley/comments/162f3eu/nikki_haleys_postdebate_victory_lap_on_cbs/"
"50","2023-08-25",1692990898,"Haley leans into her gender: If you want something done, ask a woman","  

Dear Mrs Haley,

*For clarity, I am not a democrat.* *Nor am I a republican. I support the Peoples Party. Red and blue be damned!*

Wednesday night America turned on the television to get an idea of what is ahead of us this next year. Most werent hopeful. But imagine our surprise when a politician stood on stage in front of the whole world and told the truth! Your answers echoed what many Americans have been waiting for. Finally, a politician that is listening to us! A politician that will bridge the divide that is destroying us rather than encouraging it. We heard the passion for honesty, equality, and morality. We watched you refuse to go low and stand on your own merits without attacking any of the other candidates nor the current administration. We saw someone that demonstrated respect for the institution even when you dont agree with them. We heard you in everything you said and everything you didnt say. A glimmer of hope for America!! I was ready to get my t-shirt! 

Nikki Haley #thepeoplesparty 

And then&. In an instant, that glimmer of hope was extinguished. You.. raised.. your.. hand? My jaw hit the floor and I sat stunned. No!! She cant be saying what we heard! When I recovered from my shock, I thought to myself, give her a chance. Maybe it was an impulsive moment, not quite prepared for. You tow the party line& right? Just maybe she will hear us and rethink that single moment that crushed our hope for the future. And we WILL get her into the White House one day! Even if she doesnt win this primary, she will surely bring us back from the brink of implosion in 2028. We can have hope!

And then&. you doubled down. Sigh&. You DID mean to raise your hand. You really WILL support the most morally corrupt and deplorable president of our time. You will stand up and lie to the American people. Because we heard you say, even without the explicit words, you do not believe HE is the best choice to be the role model for our children. What happened to the truth telling? What could Vice President Harris have ever done to make anyone think Ex President Trump would be a better choice to lead us back to humanity? Politics be damned!! Supporting this man and his shenanigans will be telling our children it is absolutely acceptable for a man to sexually harass, man handle, and even abuse a woman. As long as hes not a democrat. How can anyone support the selfishness demonstrated on January 6th? Teaching our children that if we dont get what we want its acceptable to throw a tantrum and step on people until you get your way. The Constitution was trampled on and people were physically hurt! Are you, Nikki Haley, really willing to compromise and disregard the very morals that make you the perfect choice for #thepeoplesparty? To what end? Just to tow the party line? 

Maybe you have sold your soul to the devil. We are left wondering how little it would take to sell out the soul of America.

If you scour social media, you will see the above opinions everywhere. You clearly won that debate! Until you didnt&. The people are ready for a change. We deserve better.

Sincerely, 

Broken Hearted and Terrified for this Countrys Future","nikkihaley",7,"https://www.reddit.com/r/nikkihaley/comments/1618c1c/haley_leans_into_her_gender_if_you_want_something/"
"51","2023-08-24",1692863408,"The Haley campaign is selling a commemorative button for $1, free shipping.","","nikkihaley",5,"https://www.reddit.com/r/nikkihaley/comments/15zv4ne/the_haley_campaign_is_selling_a_commemorative/"
"52","2023-08-08",1691513886,"Haley criticizes Tuberville hold on military promotions: Theres got to be other ways","","nikkihaley",0,"https://www.reddit.com/r/nikkihaley/comments/15lnrhw/haley_criticizes_tuberville_hold_on_military/"
"53","2023-08-07",1691367575,"#picknikkihaley2024 #votenikkihaley2024","","nikkihaley",0,"https://www.reddit.com/r/nikkihaley/comments/15k56gx/picknikkihaley2024_votenikkihaley2024/"
"54","2023-08-06",1691295171,"Nikki Haley 2024 #picknikkihaley2024","","nikkihaley",0,"https://www.reddit.com/r/nikkihaley/comments/15jfxpo/nikki_haley_2024_picknikkihaley2024/"
"55","2023-08-05",1691263737,"Donald Trump indicted: Nikki Haley says 'I wish he'd quit already. I'm tired of commenting on every Trump drama'","","nikkihaley",0,"https://www.reddit.com/r/nikkihaley/comments/15j4d2y/donald_trump_indicted_nikki_haley_says_i_wish_hed/"
