"","date_utc","timestamp","title","text","subreddit","comments","url"
"56","2023-08-02",1690974889,"Nikki Haley says if Trump accusations are true, it's ""incredibly dangerous to our national security""","","nikkihaley",0,"https://www.reddit.com/r/nikkihaley/comments/15g64me/nikki_haley_says_if_trump_accusations_are_true/"
"57","2023-07-30",1690755682,"Republican Presidential Candidate Nikki Haley's Interview On CBS' Face T...","","nikkihaley",0,"https://www.reddit.com/r/nikkihaley/comments/15dydh5/republican_presidential_candidate_nikki_haleys/"
"58","2023-07-30",1690732371,"Haley can Pivot to the middle and win this race","I think that there is a chance (however small) that Nikki Haley can pivot to the middle, gain likability by the vast majority of American voters and win this race. The battle will be an arduous one, however, and the deck is almost fully stacked against her.

There are a few avenues with which she can do it, none of which strident conservative voters (and even more so, Republican voters -tm) will like. However, if a former NY iconoclastic liberal Democrat like Donald Trump could win the Republican nomination by a landslide (and appears to be able to do so again in 2024, if nothing changes), then I truly believe some changes can lead Nikki Haley to the coveted spot.

1. Follow in the steps of Bloomberg as a (mostly) non-partisan pragmatist:  this is something that will have to develop with deft timing so that it doesnt fudge her chances at being the nominee, but whether you like it or not, the role of Evangelical Christian voters getting absolutely everything they want with no compromises is bound to end. With Roe overturned and several other landmark conservative decisions by SCOTUS, any strong motivations to get out the vote on grounds of modifying the courts and its decisions lie squarely in favor of the Democrats. Therefore, to alleviate that, you need to nominate a candidate who will toe a fine line and promise to make judicious nominations to the courts (so as not to add fire to the Democrats driving power in this area, but also not to motivate Republicans to oust her or stay home). Its a political dance that only Nikki could likely pull off. She would have to argue to a populace that seems to have largely abandoned principles and an idea of basic human common sense, in exchange for appeals to emotion, outrage, fear and groupthink (and this goes for the right as much as it does the left).

2. Not only talk the talk but walk the walk of unification: Biden talked a lot about repairing the soul of America in 2020/2021, and of healing divisions between left and right leaning segments of the nation. However, undercurrent tensions have hardly ever been worse, and we now likely have a country where most citizens wear one of two pairs of VR headsets, each showing them a vastly different reality from the other. From movies to music to climate to culture to family, and even principles like the interpretation of our freedoms (whether it be over our bodies or our trades), you have a two concentrated poles of opposing views like never before. Nikki needs to toe a very difficult line of where we can all agree, without meaningless cliches and without over-imposing or chastising/subordinating large swaths of the American public. Its a complicated task, but unlike Biden, she seems to have the intact neurons and glial cells to achieve it.

3. A fundamentally new brand: Trump did this in 2016 by (knowingly or unknowingly) popularizing a break from common economic and political theory around the exponentially greater value of global connectedness (of course there are downsides/risks to over-connectedness in trade, culture and even ideas) in a way that was simple and resonated with so many American voters; Obama did it (arguably, somewhat more easily and expectedly) in 2008 with an idea that hopeful idealism has a place in policy-making, and that centralized decision-making (by a small number of well-informed, qualified scientists &amp; experts) would not only end the calamities of the Great Recession but could progress us to a utopian society where everyone has a shot at at self-actualization (the flip side of his script being that there are a selfish/idealless but powerful few who are actively in the way of this).

Biden truly lacks such a vision or fundamentally new idea (and AFAIK so does Kamala, who will likely be our next POTUS, if Biden wins re-election in 2024, as expected). His message of unity is simply a thinly veneered repudiation of Trumpism and thats why it doesnt really work. If Nikki can provide a new additive and inspiring vision leading to a better tomorrow (and that vision is something we believe we havent really tried before; as were Obamas and Trumps visions), versus just piling onto the culture wars (a la Desantis), she just might become the first female President of the US.","nikkihaley",6,"https://www.reddit.com/r/nikkihaley/comments/15down7/haley_can_pivot_to_the_middle_and_win_this_race/"
"59","2023-07-16",1689476555,"Nikki Haley's Interview With Tucker Carlson At The Family Leadership Sum...","","nikkihaley",0,"https://www.reddit.com/r/nikkihaley/comments/150uwel/nikki_haleys_interview_with_tucker_carlson_at_the/"
"60","2023-07-02",1688307133,"Presidential Candidate Nikki Haley Discusses SCOTUS' Affirmative Action ...","","nikkihaley",0,"https://www.reddit.com/r/nikkihaley/comments/14opbks/presidential_candidate_nikki_haley_discusses/"
"61","2023-06-27",1687833696,"Opinion | Nikki Haley: My Plan to Confront the Chinese Threat","","nikkihaley",3,"https://www.reddit.com/r/nikkihaley/comments/14k15l7/opinion_nikki_haley_my_plan_to_confront_the/"
"62","2023-06-13",1686620148,"GOP Presidential Candidate Nikki Haley Weighs In On Trump's Latest Indic...","","nikkihaley",1,"https://www.reddit.com/r/nikkihaley/comments/14838ik/gop_presidential_candidate_nikki_haley_weighs_in/"
"63","2023-06-05",1685930156,"Republican Presidential Candidate Nikki Haley's CNN Town Hall With Jake ...","","nikkihaley",0,"https://www.reddit.com/r/nikkihaley/comments/140yf5i/republican_presidential_candidate_nikki_haleys/"
"64","2023-05-27",1685216590,"CNN Town Hall on June 4th, 8pm ET"," ""Republican presidential candidate [Nikki Haley](https://www.cnn.com/2023/02/14/politics/nikki-haley-2024-announcement/index.html) will participate in a live CNN presidential town hall next month in Iowa, the network announced Wednesday.

CNN anchor and chief Washington correspondent Jake Tapper will moderate the event, which will air at 8 p.m. ET on June 4.

The former South Carolina governor is one of many Republicans in a [growing field of candidates](https://www.cnn.com/2023/02/14/politics/2024-republican-presidential-contenders-list/index.html) who are vying for the partys presidential nomination and who are heavily focused on Iowa  a state early in the primary election calendar that can make or break a campaigns momentum.

Haley, who served almost two years as US ambassador to the United Nations during the Trump administration, has had to navigate running against her former boss and the current GOP front-runner.

The first woman elected as governor of South Carolina, Haley is also running against South Carolina [Sen. Tim Scott](https://www.cnn.com/2023/05/22/politics/tim-scott-2024-presidential-campaign/index.html), who she first appointed to the US Senate in 2012 to fill a vacancy left by Sen. Jim DeMint upon his retirement.

Former Arkansas Gov. Asa Hutchinson, tech entrepreneur Vivek Ramaswamy and talk radio host Larry Elder are also running for the GOP nomination, and [Florida Gov. Ron DeSantis](https://www.cnn.com/2023/05/23/politics/ron-desantis-elon-musk-president-announcement/index.html) is expected to announce his candidacy for president Wednesday evening.

The event will be the second in CNNs series of Republican presidential town halls for the 2024 cycle. The first, moderated by Kaitlan Collins, [featured former President Donald Trump](https://www.cnn.com/politics/live-news/trump-cnn-town-hall/index.html) in New Hampshire. The Iowa venue will be announced in the coming days.

The town hall will stream live for pay TV subscribers via CNN.com and CNN OTT and mobile apps under TV Channels, or CNNgo where available. The town hall will also be available On Demand to pay TV subscribers via CNN.com, CNN apps, and Cable Operator Platforms.""

[https://www.cnn.com/2023/05/24/politics/cnn-town-hall-nikki-haley/index.html](https://www.cnn.com/2023/05/24/politics/cnn-town-hall-nikki-haley/index.html)","nikkihaley",1,"https://www.reddit.com/r/nikkihaley/comments/13tgau9/cnn_town_hall_on_june_4th_8pm_et/"
"65","2023-05-19",1684514837,"Republican Presidential Candidate Nikki Haley Discusses Race Relations O...","","nikkihaley",0,"https://www.reddit.com/r/nikkihaley/comments/13m0yfp/republican_presidential_candidate_nikki_haley/"
"66","2023-05-13",1683998100,"A Fox News Special Report Into ""Who Is Nikki Haley?""","","nikkihaley",0,"https://www.reddit.com/r/nikkihaley/comments/13gn5mw/a_fox_news_special_report_into_who_is_nikki_haley/"
"67","2023-05-06",1683416164,"White House hopeful Nikki Haley takes a calculated risk on abortion","","nikkihaley",1,"https://www.reddit.com/r/nikkihaley/comments/13a60cq/white_house_hopeful_nikki_haley_takes_a/"
"68","2023-04-25",1682443887,"Republican presidential candidate Nikki Haley delivers a policy speech on abortion at the Susan B. Anthony List offices in Arlington, Virginia.","","nikkihaley",3,"https://www.reddit.com/r/nikkihaley/comments/12yq4be/republican_presidential_candidate_nikki_haley/"
"69","2023-04-11",1681248997,"Nikki Haley talks immigration, education at campaign stop in Salix, Iowa","","nikkihaley",1,"https://www.reddit.com/r/nikkihaley/comments/12iyl7z/nikki_haley_talks_immigration_education_at/"
"70","2023-04-11",1681248542,"Nikki Haley, 2024 Republican presidential hopeful, is asked about domestic enemies","","nikkihaley",0,"https://www.reddit.com/r/nikkihaley/comments/12iycwo/nikki_haley_2024_republican_presidential_hopeful/"
"71","2023-04-11",1681248497,"At Salix campaign event, Haley addresses China, national debt, education","","nikkihaley",0,"https://www.reddit.com/r/nikkihaley/comments/12iyc4v/at_salix_campaign_event_haley_addresses_china/"
"72","2023-03-30",1680195910,"Nikki Haley: Principled conservative","","nikkihaley",0,"https://www.reddit.com/r/nikkihaley/comments/126szlc/nikki_haley_principled_conservative/"
"73","2023-03-15",1678895408,"Nikki Haley Says Florida Gov. DeSantis ""Echoing"" Trump On Issues","","nikkihaley",0,"https://www.reddit.com/r/nikkihaley/comments/11s0c4d/nikki_haley_says_florida_gov_desantis_echoing/"
"74","2023-03-14",1678809539,"Haley wants entitlement program changes for younger people","","nikkihaley",1,"https://www.reddit.com/r/nikkihaley/comments/11ra0y1/haley_wants_entitlement_program_changes_for/"
"75","2023-03-14",1678757522,"Haley wants entitlement program changes for younger people","[Haley wants entitlement program changes for younger people](https://candorium.com/news/20230314011940630/haley-wants-entitlement-program-changes-for-younger-people)

Republican presidential candidate Nikki Haley is proposing changes to entitlement programs for younger generations, opening the door to potential cuts to Social Security and Medicare if elected.

At a campaign rally Monday night in Myrtle Beach, South Carolina, Haley promised not to touch the benefits of older people who retired with certain guarantees of a financial future.

Were not taking it from seniors, Haley said. Were not taking it to anyone whos been promised anything. My parents are in their 80s. I dont want anybody touching theirs.

[https://candorium.com/news/20230314011940630/haley-wants-entitlement-program-changes-for-younger-people](https://candorium.com/news/20230314011940630/haley-wants-entitlement-program-changes-for-younger-people)","nikkihaley",4,"https://www.reddit.com/r/nikkihaley/comments/11qspqx/haley_wants_entitlement_program_changes_for/"
"76","2023-03-03",1677859993,"Honestly Podcast - Interview with Nikki Haley","","nikkihaley",0,"https://www.reddit.com/r/nikkihaley/comments/11h4kpd/honestly_podcast_interview_with_nikki_haley/"
"77","2023-02-27",1677516418,"Nikki Haleys Interview On Fox News Sunday Morning Futures(FULL)","","nikkihaley",0,"https://www.reddit.com/r/nikkihaley/comments/11dgenl/nikki_haleys_interview_on_fox_news_sunday_morning/"
"78","2023-02-21",1676987310,"WATCH Republican presidential candidate Nikki Haley in Iowa, the site of the first caucus, holding a town hall in Urbandale. Last week, she held similar events in New Hampshire, site of the first primary.","","nikkihaley",0,"https://www.reddit.com/r/nikkihaley/comments/1183ugk/watch_republican_presidential_candidate_nikki/"
"79","2023-02-21",1676947828,"Watch Nikki Haley's Speech in Urbandale, Iowa at Royal Flooring.","","nikkihaley",2,"https://www.reddit.com/r/nikkihaley/comments/117sf15/watch_nikki_haleys_speech_in_urbandale_iowa_at/"
"80","2023-02-17",1676638756,"The amount of hatred you're going to see for a woman you respect is going to shock you","She won't be treated fairly by the press, EVERY major news outlet will either run outright misogynistic stories about her or will have casual misogynistic remarks about her. Don lemon said on CNN she had no right to criticize Trump's mental capacity because women are out of their prime by the time they're in their 40s.  That has nothing to do with women's minds and everything to do with sex and reproduction, and having kids while in office isn't a thing most presidents have done, but that man didn't see fit to actually think about the thing he googled, he just regurgitated sexist shit to a national audience.   


So if you're a woman supporting Haley, just mentally prepare yourself for the hate that you're going to see come out of the woodwork, sometimes from places you wouldn't expect. and it's exhausting because it'll be everywhere, always. And if you're a man supporting Haley, you'll see it too, so be nice to women, especially fellow Haley supporters, because it's difficult seeing a woman you respect, who is so much more successful and powerful than you, who has achieved more than you can ever hope to achieve, being treated so poorly simply because she was born without dangly bits


Good luck (not with the election, just with dealing with the hate) 

- A 2016 Hillary Clinton supporter.","nikkihaley",14,"https://www.reddit.com/r/nikkihaley/comments/114jqi4/the_amount_of_hatred_youre_going_to_see_for_a/"
"81","2023-02-14",1676381908,"Nikki Haley's campaign kickoff video","","nikkihaley",7,"https://www.reddit.com/r/nikkihaley/comments/1125kwt/nikki_haleys_campaign_kickoff_video/"
"82","2023-02-14",1676381827,"Nikki Haley Is Running for President, the First G.O.P. Rival to Take On Trump","","nikkihaley",2,"https://www.reddit.com/r/nikkihaley/comments/1125jy5/nikki_haley_is_running_for_president_the_first/"
"83","2022-06-20",1655694955,"Why Nikki Haley Can Win the 2024 GOP Primary","","nikkihaley",2,"https://www.reddit.com/r/nikkihaley/comments/vgbnl1/why_nikki_haley_can_win_the_2024_gop_primary/"
"84","2021-01-26",1611647979,"We need to start the campaign soon","We need to grow this subreddit to give Nikki Hailey a fighting chance against Trump","nikkihaley",7,"https://www.reddit.com/r/nikkihaley/comments/l59cit/we_need_to_start_the_campaign_soon/"
"85","2020-11-11",1605069843,"Cannot wait for 2024! First female President will be a Republican you heard it here first","","nikkihaley",4,"https://www.reddit.com/r/nikkihaley/comments/js1l6n/cannot_wait_for_2024_first_female_president_will/"
"86","2020-11-06",1604698164,"Nikki Haley 2024","We need to unite this country and have moderation and bipartisanship reign in DC. 

Go Nikki!","nikkihaley",6,"https://www.reddit.com/r/nikkihaley/comments/jpdvrr/nikki_haley_2024/"
"87","2020-08-29",1598740067,"Underappreciated","I'm not either Republican or Democrat. 

However, I admire Nikki Haley. 

Intelligent, excellent communicator, has managed to thread the needle between Trump and reality. 

I'd vote for her for president in 2024. Like nine times.","nikkihaley",2,"https://www.reddit.com/r/nikkihaley/comments/ij1l03/underappreciated/"
"88","2020-07-11",1594465093,"Nikki Haley 2024","Looking forward for this sub to explode when Nikki Haley runs for 2024. I am not an American, but I will be cheering for her.","nikkihaley",1,"https://www.reddit.com/r/nikkihaley/comments/hp859m/nikki_haley_2024/"
"89","2020-03-19",1584655704,"Nikki Haley resigns from Boeing's board over bailout pursuit","","nikkihaley",3,"https://www.reddit.com/r/nikkihaley/comments/fliwpz/nikki_haley_resigns_from_boeings_board_over/"
"90","2019-11-20",1574260490,"[Daily Beast] Nikki Haley Used System for Unclassified Material to Send Confidential Information","","nikkihaley",0,"https://www.reddit.com/r/nikkihaley/comments/dz2uta/daily_beast_nikki_haley_used_system_for/"
"91","2019-11-11",1573484654,"In memoir, Haley alleges disloyalty among some on Trump team","","nikkihaley",2,"https://www.reddit.com/r/nikkihaley/comments/dutkj2/in_memoir_haley_alleges_disloyalty_among_some_on/"
"92","2018-03-09",1520561768,"Nikki Haley: Jerusalem Was, Is, And Will Always Be The Capital of Israel [VIDEO]","","nikkihaley",1,"https://www.reddit.com/r/nikkihaley/comments/8337ws/nikki_haley_jerusalem_was_is_and_will_always_be/"
"93","2018-02-07",1517984842,"Nikki Haley accuses Russia of shielding Syria over chemical attacks","","nikkihaley",0,"https://www.reddit.com/r/nikkihaley/comments/7vu6wg/nikki_haley_accuses_russia_of_shielding_syria/"
"94","2017-12-22",1513910702,"This woman is sharp! A real badass. We need more people like her.","","nikkihaley",1,"https://www.reddit.com/r/nikkihaley/comments/7leitd/this_woman_is_sharp_a_real_badass_we_need_more/"
"95","2016-03-15",1458067019,"Nikki Haley should run for president (this year)","I know its a little late but wouldn't it be possible for her to be a choice at a contested convention?","nikkihaley",1,"https://www.reddit.com/r/nikkihaley/comments/4ajrup/nikki_haley_should_run_for_president_this_year/"
